{"$schema":"https://json-schema.org/draft/2020-12/schema","type":"object","additionalProperties":false,"required":["search_id","selection_method","records","verdict","next_permitted_action"],"properties":{"search_id":{"const":"system-one-pattern-search-2"},"selection_method":{"const":"contrasting-design-pattern-local-first-screen"},"records":{"type":"array","minItems":3,"maxItems":3,"items":{"type":"object","additionalProperties":false,"required":["source_id","pattern","source_url","official_data_url","disposition","evidence"],"properties":{"source_id":{"type":"string","pattern":"^pattern-"},"pattern":{"type":"string","minLength":20},"source_url":{"type":"string","format":"uri"},"official_data_url":{"type":"string","format":"uri"},"disposition":{"enum":["rejected-local-acquisition","rejected-nontriviality-preview","eligible-for-seven-condition-pre-admission"]},"evidence":{"type":"string","minLength":50}}}},"verdict":{"const":"one-source-eligible-for-seven-condition-pre-admission"},"next_permitted_action":{"type":"string","minLength":40}}}
