{"search_id":"system-one-pattern-search-2","selection_method":"contrasting-design-pattern-local-first-screen","records":[{"source_id":"pattern-sensory-trap-separate-treatment-models","pattern":"separate-treatment-versus-direct-treatment-contrast","source_url":"https://doi.org/10.1093/beheco/arae006","official_data_url":"https://doi.org/10.5061/dryad.ttdz08m5b","disposition":"rejected-local-acquisition","evidence":"The Dryad record documents raw behavioral data and statistical code, but its official file-stream URL returned HTTP 403 in this local environment; it cannot satisfy the local raw-content acquisition gate."},{"source_id":"pattern-crop-cue-seasonality","pattern":"clustered-intervention-with-repeated-season-measurement","source_url":"https://zenodo.org/records/13271731","official_data_url":"https://zenodo.org/records/13271731","disposition":"rejected-nontriviality-preview","evidence":"The repository description explicitly says its supplied seasonality script tests treatment, sampling, and their interaction site-wise; that obvious candidate question is already the source's stated analysis."},{"source_id":"pattern-virus-persistence-block-generalization","pattern":"replicated-block-prediction-with-held-block-check","source_url":"https://doi.org/10.1371/journal.pbio.3003315","official_data_url":"https://zenodo.org/records/15739577","disposition":"eligible-for-seven-condition-pre-admission","evidence":"The primary study reports replicate populations across host strains and multiple experimental blocks. Locally downloaded spill.char.dataset1.csv and PredictingPersistenceCorrelativeModels.R match official MD5s; the code fits pooled association models with block random effects, but no held-block predictive check was located."}],"verdict":"one-source-eligible-for-seven-condition-pre-admission","next_permitted_action":"Perform the seven-condition and nontriviality screen for the virus-persistence source only; do not audit or promote either rejection."}
